{
  "$schema": "https://json-schema.org/draft/2020-12/schema",
  "$id": "progress-export-v1.schema.json",
  "title": "Canadian Ham progress export v1",
  "type": "object",
  "required": ["schema", "version", "exportedAt", "questionProgress", "examAttempts", "preferences"],
  "properties": {
    "schema": { "const": "canadian-ham.progress-export" },
    "version": { "const": 1 },
    "exportedAt": { "$ref": "common.schema.json#/$defs/canonicalUtcTimestamp" },
    "bankId": { "$ref": "common.schema.json#/$defs/bankId" },
    "questionProgress": {
      "type": "array",
      "items": { "$ref": "common.schema.json#/$defs/questionProgressRecord" }
    },
    "examAttempts": {
      "type": "array",
      "items": { "$ref": "common.schema.json#/$defs/progressExamAttempt" }
    },
    "lessonProgress": {
      "type": "array",
      "items": { "$ref": "common.schema.json#/$defs/lessonProgressRecord" }
    },
    "lessonQuizAttempts": {
      "type": "array",
      "items": { "$ref": "common.schema.json#/$defs/lessonQuizAttempt" }
    },
    "morseCourseProgress": { "$ref": "common.schema.json#/$defs/morseCourseProgress" },
    "preferences": { "$ref": "common.schema.json#/$defs/webPreferences" }
  },
  "additionalProperties": false,
  "oneOf": [
    {
      "type": "object",
      "properties": {
        "bankId": { "$ref": "common.schema.json#/$defs/basicBankId" },
        "questionProgress": {
          "type": "array",
          "items": { "$ref": "common.schema.json#/$defs/basicQuestionProgressRecord" }
        },
        "examAttempts": {
          "type": "array",
          "items": { "$ref": "common.schema.json#/$defs/basicProgressExamAttempt" }
        },
        "lessonQuizAttempts": {
          "type": "array",
          "items": {
            "allOf": [
              { "$ref": "common.schema.json#/$defs/lessonQuizAttempt" },
              {
                "type": "object",
                "properties": {
                  "officialQuestionIds": { "type": "array", "items": { "$ref": "common.schema.json#/$defs/basicQuestionId" } },
                  "incorrectOfficialQuestionIds": { "type": "array", "items": { "$ref": "common.schema.json#/$defs/basicQuestionId" } }
                }
              }
            ]
          }
        }
      }
    },
    {
      "type": "object",
      "required": ["bankId"],
      "properties": {
        "bankId": { "$ref": "common.schema.json#/$defs/advancedBankId" },
        "questionProgress": {
          "type": "array",
          "items": { "$ref": "common.schema.json#/$defs/advancedQuestionProgressRecord" }
        },
        "examAttempts": {
          "type": "array",
          "items": { "$ref": "common.schema.json#/$defs/advancedProgressExamAttempt" }
        },
        "lessonProgress": { "type": "array", "maxItems": 0 },
        "lessonQuizAttempts": { "type": "array", "maxItems": 0 }
      }
    }
  ]
}
