{
  "schema": "canadian-ham.progress-export",
  "version": 1,
  "exportedAt": "2026-01-02T03:04:05.000Z",
  "questionProgress": [
    {
      "questionId": "B-001-001-001",
      "attempts": 1,
      "correctAttempts": 1,
      "lastAttemptedAt": "2026-01-02T03:00:00.000Z",
      "lastResult": "correct",
      "recentResults": [true],
      "leitner": { "box": 1, "dueAt": "2026-01-03T03:00:00.000Z" },
      "notes": null
    }
  ],
  "examAttempts": [
    {
      "id": "attempt-2026-01-02T03:10:00.000Z-local-legacy-fixture",
      "mode": "mock-exam",
      "seed": "legacy-fixture",
      "startedAt": "2026-01-02T03:00:00.000Z",
      "submittedAt": "2026-01-02T03:10:00.000Z",
      "timer": { "enabled": false, "secondsAllowed": null, "secondsElapsed": 600 },
      "items": [
        {
          "position": 1,
          "questionId": "B-001-001-001",
          "subsectionId": "B-001-001",
          "categoryId": "B-001",
          "choicePermutation": [0, 1, 2, 3],
          "selectedSourceIndex": 0,
          "isCorrect": true,
          "flagged": false
        }
      ],
      "score": {
        "correct": 1,
        "total": 1,
        "percent": 100,
        "passed": true,
        "honours": true,
        "categoryBreakdown": [
          { "categoryId": "B-001", "correct": 1, "total": 1, "percent": 100 }
        ],
        "weakSubsectionIds": []
      }
    }
  ],
  "lessonProgress": [
    { "lessonId": "L-001-01", "readAt": "2026-01-02T03:01:00.000Z", "readCount": 1 }
  ],
  "lessonQuizAttempts": [],
  "preferences": { "practiceMode": "immediate", "examTimerEnabled": false, "theme": "system" }
}
